Title,Authors,PublicationType,URL,KeyFindings,Abstract
Clinical utility of cancer family history collection in primary care.,"Wilson, Qureshi, Little, Santaguida, Carroll, Allanson, Keshavarz, Raina","Journal Article, Review, Systematic Review",https://pubmed.ncbi.nlm.nih.gov/20804228/,"This systematic review aimed to evaluate, within unselected populations, the performance of family history (FHx)-based models in predicting cancer risk. Eligibility criteria included English studies evaluating breast, colorectal, ovarian, or prostate cancers. No evaluations demonstrated more than modest discriminatory accuracy at an individual level.","This systematic review aimed to evaluate, within unselected populations: the (1) performance of family history (FHx)-based models in predicting cancer risk; (2) overall benefits and harms associated with established cancer prevention interventions; (3) impact of FHx-based risk information on the uptake of preventive interventions; and (4) potential for harms associated with collecting cancer FHx. MEDLINE, EMBASE, CINAHL, Cochrane Central, Cochrane Database of Systematic Reviews, and PsycINFO were searched from 1990 to June 2008 inclusive. Cancer guidelines and recommendations were searched from 2002 forward and systematic reviews from 2003 to June 2008. Standard systematic review methodology was employed. Eligibility criteria included English studies evaluating breast, colorectal, ovarian, or prostate cancers. Study designs were restricted to systematic review, experimental and diagnostic types. Populations were limited to those unselected for cancer risk. Interventions were limited to collection of cancer FHx; primary and/or secondary prevention interventions for breast, colorectal, ovarian, and prostate cancers. Accuracy of models. Seven eligible studies evaluated systems based on the Gail model, and on the Harvard Cancer Risk Index. No evaluations demonstrated more than modest discriminatory accuracy at an individual level. No evaluations were identified relevant to ovarian or prostate cancer risk. Efficacy of preventive interventions. From 29 eligible systematic reviews, seven found no experimental studies evaluating interventions of interest. Of the remaining 22, none addressed ovarian cancer prevention. The reviews were generally based on limited numbers of randomized or controlled clinical trials. There was no evidence either to support or refute the use of selected chemoprevention interventions, there was some evidence of effectiveness for mammography and fecal occult blood testing. Uptake of intervention. Three studies evaluated the impact of FHx-based risk information on uptake of clinical preventive interventions for breast cancer. The evidence is insufficient to draw conclusions on the effect of FHx-based risk information on change in preventive behavior. Potential harms of FHx taking. One uncontrolled trial evaluated the impact of FHx-based breast cancer risk information on psychological outcomes and found no evidence of significant harm. Our review indicates a very limited evidence base with which to address all four of the research questions: 1) the few evaluations of cancer risk prediction models do not suggest useful individual predictive accuracy; 2) the experimental evidence base for primary and secondary cancer prevention is very limited; 3) there is insufficient evidence to assess the effect of FHx-based risk assessment on preventive behaviors; 4) there is insufficient evidence to assess whether FHx-based personalized risk assessment directly causes adverse outcomes."
Prophylactic antibiotics to prevent surgical site infection after breast cancer surgery.,"Cunningham, Bunn, Handscomb","Journal Article, Meta-Analysis, Review, Systematic Review",https://pubmed.ncbi.nlm.nih.gov/16625637/,Infection rates for surgical treatment of breast cancer are documented at between three and 15%. Pre and peri-operative antibiotics have been found to be useful in lowering infection rates in other surgical groups. There is no current consensus on prophylactic antibiotic use in breast cancer surgery.,"Surgery has been used as part of breast cancer treatment for centuries; however any surgical procedure has the potential risk of infection. Infection rates for surgical treatment of breast cancer are documented at between three and 15%, higher than average for a clean surgical procedure. Pre and peri-operative antibiotics have been found to be useful in lowering infection rates in other surgical groups, yet there is no current consensus on prophylactic antibiotic use in breast cancer surgery. To determine the effects of prophylactic antibiotics on the incidence of surgical site infection after breast cancer surgery. We searched the Cochrane Wounds and Breast Cancer Groups Specialised Registers, the Cochrane Central Register of Controlled Trials (CENTRAL) issue 1 2006. MEDLINE 2002-2005, EMBASE 1980-2005, NRR issue 1 2005, CINAHL 1982-2004 and SIGLE 1976-2004. Companies and experts in the field were contacted and reference lists were checked. No language restrictions were applied. Randomised controlled trials of pre and peri-operative antibiotics for patients undergoing surgery for breast cancer were included. Primary outcomes were, incidence of breast wound infection and adverse reactions to treatment. Two authors independently examined the title and abstracts of all studies identified by the search strategy, then assessed study quality and extracted data from those that met the inclusion criteria. Six studies met the inclusion criteria. All six evaluated pre-operative antibiotic compared with no antibiotic or placebo. Pooling of the results demonstrated that prophylactic antibiotics significantly reduce the incidence of surgical site infection for patients undergoing breast cancer surgery without reconstruction (pooled RR 0.66, 95% CI, 0.48 to 0.89). No studies presented separate data for patients who underwent reconstructive surgery at the time of removal of the breast tumour. Prophylactic antibiotics reduce the risk of surgical site infection in patients undergoing surgery for breast cancer. The potential morbidity caused by infection, such as delays in wound healing or adjuvant cancer treatments must be balanced against the cost of treatment and potential adverse effects such as drug reactions or increased bacterial resistance. Further studies of patients undergoing immediate breast reconstruction would be useful as studies have identified this group as being at higher risk of infection than those who do not undergo immediate breast reconstruction."
Evolving strategies for prostate cancer chemoprevention trials.,Lieberman,"Journal Article, Review",https://pubmed.ncbi.nlm.nih.gov/12682772/,"Prostate cancer chemoprevention (CP) can be defined as the use of natural and synthetic agents that inhibit, reverse or regress precancer and delay progression to invasive cancer. During the past two decades several CP strategies have evolved.","Prostate cancer chemoprevention (CP) can be defined as the use of natural and synthetic agents that inhibit, reverse or regress precancer and delay progression to invasive cancer. During the past two decades several CP strategies have evolved. The first generation of CP trials tested the efficacy of antioxidants and vitamins including B-carotene, vitamin A, retinol, 13 cis retinoic acid, vitamins E, C and selenium. Although these trials were disappointing, provocative hypotheses were generated for selenium and vitamin E that set the stage for future prostate trials. In the 1990s, the NCI launched a second generation of large CP trials aimed at breast and prostate cancer. One of these trials is the PCPT, testing the efficacy of a 5 alpha-reductase inhibitor-finasteride to prevent prostate cancer in 18,000 men. Although PCPT is still in progress, the NCI recently launched a second large primary prostate CP trial called SELECT, testing the efficacy of selenium and vitamin E in 32,400 men. The Prostate Cancer Progress Report to the Director of NCI in 1998 challenged the research community to design more efficient CP trials for prostate cancer. In response, the NCI has evolved a third generation of CP trials. This involves pharmacologically driven translational science research including agents and their targets, biomarker endpoints, suitable clinical models for testing agents and efficient trial designs employing high risk cohorts and surrogate endpoints. In summary, a dual strategy for CP is being developed which includes public health measures and a medical intervention approach."
"Chemoprevention of breast cancer, proteomic discovery of genistein action in the rat mammary gland.","Rowell, Carpenter, Lamartiniere","Journal Article, Research Support, N.I.H., Extramural, Research Support, Non-U.S. Gov't, Research Support, U.S. Gov't, Non-P.H.S.",https://pubmed.ncbi.nlm.nih.gov/16317154/,Genistein suppresses chemically induced mammary cancer in rats. Gestational or adult-only exposures do not provide protection. An inverse relation exists between cancer susceptibility and mammary gland differentiation. Early prepubertal exposure to genistein enhances cell proliferation.,"Genistein, the primary isoflavone component of soy, consumed in the diet during the prepubertal period only, and the combined prepubertal and adult periods, suppresses chemically induced mammary cancer in rats. Gestational or adult-only exposures do not provide protection. An inverse relation exists between cancer susceptibility and mammary gland differentiation. The current study used proteomic technology to investigate genistein mechanisms of action as related to programming against chemically induced mammary cancer. Rats were injected subcutaneously with 500 microg genistein/g body weight on d 16, 18, and 20 postpartum. At d 21, mammary glands were subjected to 2-dimensional polyacrylamide gel electrophoresis. After gel scanning, image analysis, and MS, 6 proteins were determined to be differentially regulated and identified. One protein, GTP-cyclohydrolase 1 (GTP-CH1), was confirmed as being significantly upregulated at d 21 by immunoblot analysis. Investigation of downstream signaling from GTP-CH1 showed that tyrosine hydroxylase was upregulated and vascular endothelial growth factor receptor 2 (VEGFR2) was downregulated in the mammary glands of 50-d-old rats treated with genistein in the prepubertal period. This and previous work suggest that early prepubertal exposure to genistein enhances cell proliferation by upregulating GTP-CH1 and the epidermal growth factor (EGF)-signaling pathway, and hence cell differentiation and gland maturation. This unique developmental maturation leads to a new biochemical blueprint, whereby the cells have reduced EGF signaling and VEGFR2, which renders the mature mammary gland less proliferative and less susceptible to cancer. This study demonstrated the usefulness of proteomics for the discovery of novel pathways that may be involved in cancer prevention."
Acceptability of Localized Cancer Risk Reduction Interventions Among Individuals at Average or High Risk for Cancer.,"Samimi, Heckman-Stoddard, Kay, Bloodgood, Coa, Robinson, Tennant, Ford, Szabo, Minasian","Journal Article, Research Support, N.I.H., Extramural",https://pubmed.ncbi.nlm.nih.gov/30824471/,"Locally delivered chemopreventive agents, where direct action on the primary organ may limit systemic toxicity, are emerging as an option for high-risk individuals. Clinical trials that collect additional patient-centered data including side effects and how these interventions fit into an individual's lifestyle are imperative.","Individuals at high risk for cancer, including those already diagnosed with premalignant lesions, can potentially benefit from chemopreventive interventions to reduce cancer risk. However, uptake and acceptability have been hindered due to the risk of systemic toxicity and other adverse effects. Locally delivered chemopreventive agents, where direct action on the primary organ may limit systemic toxicity, are emerging as an option for high-risk individuals. While a number of clinical trials support the development of chemopreventive agents, it is crucial to understand the factors and barriers that influence their acceptability and use. We conducted 36 focus groups with 198 individuals at average and high risk of breast/ovarian, gynecologic, and head/neck/oral and lung cancers to examine the perceptions and acceptability of chemopreventive agents. Participants' willingness to use chemopreventive agents was influenced by several factors, including perceived risk of cancer, skepticism around prevention, previous knowledge of chemopreventive agents, support from trusted sources of health information, participation in other cancer-related risk-reduction activities, previous experience with similar modalities, cost, regimen, side effects, and perceived effectiveness of the preventive intervention. Our findings indicate that individuals may be more receptive to locally delivered chemopreventive agents if they perceive themselves to be at high risk for cancer and are given the necessary information regarding regimen and side effects to make an informed decision. Clinical trials that collect additional patient-centered data including side effects and how these interventions fit into an individual's lifestyle are imperative to improve uptake of chemopreventive agents."
Chemoprevention activity of dipyridamole in the MMTV-PyMT transgenic mouse model of breast cancer.,"Wang, Schwab, Fan, Seagroves, Buolamwini","Journal Article, Research Support, N.I.H., Extramural",https://pubmed.ncbi.nlm.nih.gov/23447563/,Dipyridamole (DPM) is widely used to prevent strokes and vascular thrombosis. Combination therapy of DPM and antimetabolites has shown synergistic anticancer activity. Study investigated the chemopreventive effects of D PM in the mouse mammary tumor virus promoter-driven polyoma middle T oncoprotein metastatic breast cancer model.,"Dipyridamole (DPM) is widely used to prevent strokes and vascular thrombosis. Combination therapy of DPM and antimetabolites has shown synergistic anticancer activity. This study investigated the chemopreventive effects of DPM in the mouse mammary tumor virus promoter-driven polyoma middle T oncoprotein metastatic breast cancer model. We also investigated the effects of DPM on gene and miRNA expression. Chemopreventive activity was assessed by comparing the time to onset of palpable lesions, primary tumor growth kinetics, and the number of lung metastases in transgenic mice treated with DPM or vehicle. Gene expression and miRNA expression profiles of mammary tumor tissues were then analyzed using the Affymetrix GeneChip or miRNA 2.0 arrays. Real-time quantitative PCR was used to confirm changes in gene expression. Treatment with DPM beginning at the age of 4 weeks delayed the onset of palpable lesions, delayed tumor progression, and suppressed lung metastasis. Microarray gene expression analysis identified 253 genes differentially expressed between DPM-treated and control mammary tumors. miRNA expression analysis revealed that 53 miRNAs were altered by DPM treatment. The results indicate that DPM has chemoprevention activity against breast cancer tumorigenesis and metastasis in mice. The array analyses provide insights into potential mechanisms of DPM's chemopreventive effects, involving upregulation of several genes and miRNAs known to suppress cancer growth and/or metastasis and downregulation of genes known to promote cancer. Some of these genes have not been previously studied in breast cancer and may serve as novel molecular targets for breast cancer chemoprevention."
Current issues in prevention of mother-to-child transmission of HIV-1.,Coovadia,"Journal Article, Review",https://pubmed.ncbi.nlm.nih.gov/19532071/,A large gap in prevention of mother-to-child-transmission [MTCT] is being increasingly bridged. Breastfeeding transmission affects the majority of HIV-infected pregnant women and children in the world. Prevention of unwanted pregnancies in all women living in high HIV prevalence regions will probably reduce the risk. Health infrastructure improvement in developing countries is central to the application of research findings.,"To review new evidence in prevention of mother-to-child-transmission of HIV-1, which establishes, in principle, the feasibility of greatly improved effectiveness in developing countries. This review presents evidence that demonstrates that a large gap in prevention of mother-to-child-transmission [MTCT] is being increasingly bridged. Recent studies have addressed issues on postnatal transmission of HIV-1 through breastfeeding. Breastfeeding transmission affects the majority of HIV-infected pregnant women and children in the world and who live in Africa and are often poor. Prevention of unwanted pregnancies in all women living in high HIV prevalence regions will probably reduce the risk of HIV-positive pregnancies. These studies demonstrate the success of the following three types of interventions:primary prevention of HIV-1 in women;prophylaxis with antiretroviral drugs in breastfeeding infants;prophylaxis with antiretroviral drugs for lactating mothers.It is also clear that key barriers to implementing these findings in developing countries are weak and ineffectual health systems. Therefore, identifying needs for improving health service delivery are critical; an example of the synergy between prevention and treatment through integrated services is given. Recent data on primary prevention of HIV-1 in women of child-bearing age, and use of antiretrovirals in breastfeeding infants and lactating mothers, report successful interventions for the prevention of breastfeeding transmission of HIV-1. Health infrastructure improvement in developing countries is central to the application of research findings to implementation of MTCT programmes."
The advancement of cancer chemoprevention by revision of clinical trial strategies.,Sharma,"Journal Article, Review",https://pubmed.ncbi.nlm.nih.gov/11887091/,The focus of oncological drug development has shifted from cytotoxic chemotherapy to rationally designed agents that target specific molecules associated with malignant cells or their environment. Tamoxifen and celecoxib have been licensed in the USA for the chemoprevention of breast and colorectal cancers respectively.,"After a quarter of a century of rapid advances in cancer research, the focus of oncological drug development has shifted from cytotoxic chemotherapy to rationally designed agents that target specific molecules associated with malignant cells or their environment. As a consequence of greater public awareness of health related issues and population screening, the detection of early cancer or premalignant lesions has demonstrated the potential that exists for targeting the same molecules during carcinogenesis. One method of such intervention is chemoprevention, the inhibition, retardation or reversal of carcinogenic processes by chemical means. Tamoxifen and celecoxib have been licensed in the USA for the chemoprevention of breast and colorectal cancers respectively in certain well-defined ""at risk"" individuals. Unfortunately, many large-scale cancer chemoprevention trials have yielded negative results, and a few may even have caused harm to healthy individuals considered at risk of developing cancer. In this article, the importance of not putting the cart before the horse is argued. In particular, two factors in chemopreventive agent development will be emphasised: phase I/II studies in patients with cancer or patients at risk of second primary tumors and the validation and incorporation of biomarkers of carcinogenesis from the earliest phases of clinical development. This structured approach currently emerging is providing pharmacological and mechanistic data on novel agents which will prove essential in the planning of larger-scale commitments."
Symptoms and QOL as Predictors of Chemoprevention Adherence in NRG Oncology/NSABP Trial P-1.,"Land, Walcott, Liu, Wickerham, Costantino, Ganz","Clinical Trial, Phase III, Journal Article, Multicenter Study, Randomized Controlled Trial, Research Support, N.I.H., Extramural, Research Support, Non-U.S. Gov't, Research Support, U.S. Gov't, Non-P.H.S.",https://pubmed.ncbi.nlm.nih.gov/26615179/,Tamoxifen provides a 50% reduction in the incidence of breast cancer among high-risk women. Many do not adhere to the five-year course of therapy. The National Surgical Adjuvant Breast and Bowel Project P-1 study evaluated whether participant-reported outcomes were associated with drug adherence.,"Tamoxifen provides a 50% reduction in the incidence of breast cancer (BC) among high-risk women, yet many do not adhere to the five-year course of therapy. Using the prospective double-blind National Surgical Adjuvant Breast and Bowel Project P-1 study, we evaluated whether participant-reported outcomes were associated with drug adherence and whether baseline behavioral risk factors modified those associations. P-1 participants were randomly assigned to placebo vs tamoxifen (20mg/day). Mixed effects logistic regression was used to evaluate whether baseline or three-month SF-36 quality of life (QOL) mental and physical component summaries (MCS, PCS), and participant-reported symptoms (gynecologic, vasomotor, sexual, and other) predicted 12-month drug adherence (76-100% of assigned medication). The evaluation accounted for age, treatment, estimated breast cancer risk, education, baseline smoking, alcohol consumption, and obesity. All statistical tests were two-sided. Participants enrolled at least three years before trial unblinding and without medically indicated discontinuation before 12 months were eligible for the present analyses (n = 10 576). At 12 months, 84.3% were adherent. Statistically significant predictors of adherence were: three-month MCS (odds ratio [OR] = 1.15 per 10 points, 95% confidence interval [CI] = 1.06 to 1.25); three-month gynecologic symptoms among moderate alcohol drinkers (OR = .79, 95% CI = 0.72 to 0.88); baseline vasomotor symptoms among participants assigned tamoxifen (OR = .88, 95% CI = 0.80 to 0.97); and three-month sexual symptoms among younger participants (OR = .89 at age 41 years, 95% CI = 0.80 to 0.99). The strongest association was with three-month other symptoms (OR = .77, 95% CI = 0.63 to 0.93). PCS was not associated with adherence. Symptom and QOL associations were not modified by smoking or obesity. Promoting QOL and managing symptoms early in therapy may be important strategies to improve adherence."
Molecular genetics and management strategies in hereditary cancer syndromes.,"Hanna, Mentzer","Journal Article, Research Support, Non-U.S. Gov't, Review",https://pubmed.ncbi.nlm.nih.gov/12674901/,"The origin, characteristics, and lifetime risk for the following five types of hereditary cancer (HCS) syndromes are briefly described. Most are caused by mutations in tumor suppressor genes. Patients with HCS have a higher than normal risk of a second malignancy.","The origin, characteristics, and lifetime risk for the following five types of hereditary cancer (HCS) syndromes are briefly described in this review: hereditary breast and ovarian cancer (HBOC) syndrome, familial adenomatous polyposis (FAP), and hereditary nonpolyposis colorectal cancer (HNPCC) syndrome, hereditary diffuse gastric cancer (HDGC) syndrome, and medullary thyroid carcinoma (MTC). Most are caused by mutations in tumor suppressor genes. In HCS, a single copy of the mutated tumor suppressor gene is inherited, and mutation of the second wild type allele of the gene is required for tumorigenesis. Patients with HCS have a higher than normal risk of a second malignancy. Management strategies to address increased cancer risk in HCS include genetic counseling and testing, targeted surveillance, chemoprevention, and prophylactic surgery. Genetic testing for high-risk family members is strongly recommended. Available data indicate surgical prophylaxis is more successful than surveillance in reducing cancer risk in carriers of BRCA, CDH1, APC, and RET mutation."
