Title,Authors,PublicationType,URL,KeyFindings,Abstract
Aromatase inhibitors for the treatment and prevention of breast cancer.,"Kalidas, Brown","Comparative Study, Journal Article, Review",https://pubmed.ncbi.nlm.nih.gov/15899070/,"Tamoxifen, a selective estrogen receptor modulator, is approved for use in metastatic breast cancer (MBC) Aromatase inhibitors, recently approved for the treatment of MBC and in the adjuvant setting, are proving to be slightly more effective.","In a review of current information on aromatase inhibitors (AIs) and their use in breast cancer treatment and prevention, published reports were obtained through a Medline search. Tamoxifen, a selective estrogen receptor modulator, is approved for use in metastatic breast cancer (MBC), the adjuvant treatment of breast cancer, and the prevention of breast cancer in women at high risk. The 50% reduction in breast cancer incidence seen with tamoxifen is significant for women at increased risk but is accompanied by notable toxicities such as thrombotic events and endometrial cancer. Therefore, the development of other effective agents with less toxicity would be a major advance in breast cancer prevention. Aromatase inhibitors, recently approved for the treatment of MBC and in the adjuvant setting, are proving to be slightly more effective than tamoxifen therapy. These drugs, approved for use in only postmenopausal women, inhibit the enzyme aromatase and thereby lower circulating functional estrogen. To date, the most concerning side effect of these agents is an increase in fracture rate. Compared with tamoxifen, thrombotic events and endometrial cancer rates are much lower. Ongoing data from the Arimidex, Tamoxifen, Alone or in Combination trial continue to favor anastrozole over tamoxifen in the reduction of primary contralateral breast cancers. This information has prompted breast cancer chemoprevention trials with AIs. Although tamoxifen is the gold standard for prevention therapy, results of ongoing studies may indicate a role for AIs in the prevention of breast cancer."
Hereditary breast and ovarian cancer due to mutations in BRCA1 and BRCA2.,"Petrucelli, Daly, Feldman","Journal Article, Review",https://pubmed.ncbi.nlm.nih.gov/20216074/,Hereditary breast and ovarian cancer due to mutations in the BRCA1 and BRCa2 genes is the most common cause of hereditary forms of both breast and Ovarian cancer. The overall prevalence of BRC a1/2 mutations is estimated to be from 1 in 400 to 1 in 800 with a higher prevalence in the Ashkenazi Jewish population.,"Hereditary breast and ovarian cancer due to mutations in the BRCA1 and BRCA2 genes is the most common cause of hereditary forms of both breast and ovarian cancer. The overall prevalence of BRCA1/2 mutations is estimated to be from 1 in 400 to 1 in 800 with a higher prevalence in the Ashkenazi Jewish population (1 in 40). Estimates of penetrance (cancer risk) vary considerably depending on the context in which they were derived and have been shown to vary within families with the same BRCA1/2 mutation. This suggests there is no exact risk estimate that can be applied to all individuals with a BRCA1/2 mutation. The likelihood of harboring a BRCA1 or BRCA2 mutation is dependent on one's personal and/or family history of cancer and can be estimated using various mutation probability models. For those individuals who have a BRCA1 or BRCA2 mutation, several screening and primary prevention options have been suggested, including prophylactic surgery and chemoprevention. Once a BRCA1 or BRCA2 mutation has been identified in a family, testing of at-risk relatives can identify those family members who also have the familial mutation and thus need increased surveillance and early intervention when a cancer is diagnosed."
The science behind vitamins and natural compounds for breast cancer prevention. Getting the most prevention out of it.,"Lazzeroni, Gandini, Puntoni, Bonanni, Gennari, DeCensi","Journal Article, Review",https://pubmed.ncbi.nlm.nih.gov/22015291/,"This review highlights the role of vitamins and natural compounds in breast cancer prevention, with a particular focus on Vitamin D. Several studies have shown that a high proportion of women at-risk for breast cancer or affected by the disease have deficient vitamin D levels. The U-shaped relationship between 250 H-D levels observed in different studies suggests the need to avoid both deficient and too high levels.","This review highlights the role of vitamins and natural compounds in breast cancer prevention, with a particular focus on Vitamin D. In the last decades, both encouraging and discouraging results about the association between antioxidant supplementation and cancer have been reported to public and scientific community. Their safe and favorable toxicity profile makes them suitable to be investigated in a preventive setting. However, a recent large meta-analysis showed that treatment with beta carotene, vitamin A, and vitamin E may increase mortality, whereas the potential roles of vitamin C and selenium on mortality need further study. Likewise, folate levels were not associated with reduced breast cancer risk in a recent meta-analysis. Several studies have shown that a high proportion of women at-risk for breast cancer or affected by the disease have deficient vitamin D levels, i.e., 250 H-D <20 ng/ml or 50 nmol/L. While the association between Vitamin D levels and breast cancer risk/prognosis is still controversial, the U-shaped relationship between 250 H-D levels observed in different studies suggests the need to avoid both deficient and too high levels. Further trials using an optimal dose range are needed to assess the preventive and therapeutic effect of vitamin D. Finally, Fenretinide, a pro-apoptotic and pro-oxidant vitamin A derivative, has shown promise in several trials and its preventive potential is being assessed in young women at very high risk for breast cancer."
Screening and prevention of breast cancer in primary care.,"Tice, Kerlikowske",Journal Article,https://pubmed.ncbi.nlm.nih.gov/19616154/,There is little controversy that mammography reduces the risk of dying from breast cancer by about 23%. The harms associated with false-positive results and overdiagnosis limit the net benefit of mammography. Digital mammography is more sensitive than film mammography in young women. Magnetic resonance imaging may benefit the highest risk women.,"Mammography remains the mainstay of breast cancer screening. There is little controversy that mammography reduces the risk of dying from breast cancer by about 23% among women between the ages of 50 and 69 years, although the harms associated with false-positive results and overdiagnosis limit the net benefit of mammography. Women in their 70s may have a small benefit from screening mammography, but overdiagnosis increases in this age group as do competing causes of death. While new data support a 16% reduction in breast cancer mortality for 40- to 49-year-old women after 10 years of screening, the net benefit is less compelling in part because of the lower incidence of breast cancer in this age group and because mammography is less sensitive and specific in women younger than 50 years. Digital mammography is more sensitive than film mammography in young women with similar specificity, but no improvements in breast cancer outcomes have been demonstrated. Magnetic resonance imaging may benefit the highest risk women. Randomized trials suggest that self-breast examination does more harm than good. Primary prevention with currently approved medications will have a negligible effect on breast cancer incidence. Public health efforts aimed at increasing mammography screening rates, promoting regular exercise in all women, maintaining a healthy weight, limiting alcohol intake, and limiting postmenopausal hormone therapy may help to continue the recent trend of lower breast cancer incidence and mortality among American women."
Incorporating Biomarkers in Studies of Chemoprevention.,"Fabian, Kimler","Journal Article, Review",https://pubmed.ncbi.nlm.nih.gov/26987531/,"Despite Food and Drug Administration approval of tamoxifen and raloxifene for breast cancer risk reduction, uptake of these drugs for primary prevention in the United States is only 4% for risk eligible women. Side effects coupled with incomplete efficacy and lack of a survival advantage are the likely reasons.","Despite Food and Drug Administration approval of tamoxifen and raloxifene for breast cancer risk reduction and endorsement by multiple agencies, uptake of these drugs for primary prevention in the United States is only 4% for risk eligible women likely to benefit from their use. Side effects coupled with incomplete efficacy and lack of a survival advantage are the likely reasons. This disappointing uptake, after the considerable effort and expense of large Phase III cancer incidence trials required for approval, suggests that a new paradigm is required. Current prevention research is focused on (1) refining risk prediction, (2) exploring behavioral and natural product interventions, and (3) utilizing novel translational trial designs for efficacy. Risk biomarkers will play a central role in refining risk estimates from traditional models and selecting cohorts for prevention trials. Modifiable risk markers called surrogate endpoint or response biomarkers will continue to be used in Phase I and II prevention trials to determine optimal dose or exposure and likely effectiveness from an intervention. The majority of Phase II trials will continue to assess benign breast tissue for response and mechanism of action biomarkers. Co-trials are those in which human and animal cohorts receive the same effective dose and the same tissue biomarkers are assessed for modulation due to the intervention, but then additional animals are allowed to progress to cancer development. These collaborations linking biomarker modulation and cancer prevention may obviate the need for cancer incidence trials for non-prescription interventions."
Radial Profile Analysis of Epithelial Polarity in Breast Acini: A Tool for Primary (Breast) Cancer Prevention.,"Manning, Holmes, Bonin, Vidi",Journal Article,https://pubmed.ncbi.nlm.nih.gov/31998733/,"In the breast and in other organs of epithelial origin, apical-basal polarity is key to homeostasis and is one of the first tissue characteristics lost during cancer initiation. We developed an algorithm that essentially replaces the human eye to objectively quantify epithelial polarity in microscopy images of breast glandular units (acini)","Preventing cancer is vastly better than treating the disease in terms of a patient's quality of life and healthcare costs. Yet, to screen for chemopreventative drugs or evaluate interventions aimed at lowering cancer risk, quantitative readouts of risk are needed. In the breast and in other organs of epithelial origin, apical-basal polarity is key to homeostasis and is one of the first tissue characteristics lost during cancer initiation. Therefore, apical-basal polarity may be leveraged as an ""architectural"" determinant of cancer risk. A classic approach to quantify the localization of epithelial polarity markers is visual scoring at the microscope by trained investigators. This approach is time-intensive and limited to low throughput. To increase the speed, accuracy, and scoring volume, we developed an algorithm that essentially replaces the human eye to objectively quantify epithelial polarity in microscopy images of breast glandular units (acini). Acini in culture are identified based on a nuclear stain and the corresponding masks are divided into concentric terraces of equal width. This positional information is used to calculate radial intensity profiles (RP) of polarity markers. Profiles with a steep slope represent polarized structures, whereas more horizontal curves are indicative of non-polarized acini. To compare treatment effects, RP curves are integrated into summary values of polarity. We envision applications of this method for primary cancer prevention research with acini organoids, specifically (1) to screen for chemoprevention drugs, (2) for toxicological assessment of suspected carcinogens and pharmacological hit compounds, and (3) for personalized evaluation of cancer risk and risk-reducing interventions. The RadialProfiler algorithm developed for the MATLAB computing environment and for users without prior informatics knowledge is publicly available on the Open Science Framework (OSF)."
"A multidisciplinary approach to the management of breast cancer, part 1: prevention and diagnosis.","Pruthi, Brandt, Degnim, Goetz, Perez, Reynolds, Schomberg, Dy, Ingle","Journal Article, Review",https://pubmed.ncbi.nlm.nih.gov/17673070/,"Breast cancer is the most common cancer among women in the United States. A multidisciplinary focus that entails prevention, diagnosis, and treatment has led to significant strides in the reduction of breast cancer incidence and mortality.","Breast cancer is the most common cancer among women in the United States, with an estimated 200,000 new cases diagnosed annually. A multidisciplinary focus that entails prevention, diagnosis, and treatment has led to significant strides in the reduction of breast cancer incidence and mortality. Additionally, breast cancer management has become increasingly complex, requiring comprehensive assessment and review of multiple issues that include the role of genetic testing, imaging and breast magnetic resonance imaging, surgical and reconstructive options, and a variety of new adjuvant therapies. It has become more evident that a multidisciplinary team approach that involves a spectrum of breast experts is necessary to provide optimal care to patients. This team includes medical oncologists, breast radiologists, breast pathologists, surgical breast specialists, radiation oncologists, geneticists, and primary care physicians. Furthermore, patient knowledge has increased use of the Internet, and more patients are seeking a multidisciplinary approach to treatment. This review considers information for health care professionals who will facilitate optimal patient care for women at increased risk for or presenting with a new diagnosis of breast cancer. The multidisciplinary team of authors, representing the different disciplines, has selected important state-of-the-art issues that arise in their daily practices for consideration, rather than summarizing what is already available in textbooks."
Breast cancer risk management.,"Reeder, Vogel","Journal Article, Review",https://pubmed.ncbi.nlm.nih.gov/18269772/,"Tamoxifen is the best studied of these agents and has been shown to reduce the incidence of all breast cancers by 38% and ER-positive tumors by 48%. Despite this large potential risk reduction, risk management with chemopreventive agents is still not routine. The primary deterrents are believed to be the significant adverse events associated with tamox ifen as well as a perceived decline in quality of life (QOL)","Breast cancer is a devastating illness that affects tens of thousands of American women each year. Although no one can predict who will actually develop breast cancer, a number of risk factors have been found that allow clinicians to identify the women at highest risk. Recent research has focused on exploring options, such as chemoprevention, to prevent high-risk women from developing breast cancer. The selective estrogen receptor (ER) modulators (SERMs) were a logical choice for chemoprevention because of their well-known estrogen antagonist effects in the breast. Tamoxifen is the best studied of these agents and has been shown to reduce the incidence of all breast cancers by 38% and ER-positive tumors by 48%.(1) However, despite this large potential risk reduction, risk management with chemopreventive agents is still not routine. The primary deterrents are believed to be the significant adverse events associated with tamoxifen as well as a perceived decline in quality of life (QOL).(2-4) These concerns led researchers to consider other possible agents that would still be effective but would have fewer or more acceptable side effects than tamoxifen. Raloxifene was proposed as an alternative to tamoxifen based on its estrogen antagonist effects in the breast and its relative safety as an osteoporosis agent. In this article, we will review the trials that led to the emergence of both tamoxifen and raloxifene as chemopreventive agents and will then offer a management strategy for breast cancer prevention in the primary care setting."
Cancer prevention trials and primary care physicians: factors associated with recommending trial enrollment.,"Battaglia, Ash, Prout, Freund","Journal Article, Research Support, N.I.H., Extramural, Research Support, Non-U.S. Gov't",https://pubmed.ncbi.nlm.nih.gov/16476525/,"Primary care providers are less likely to encourage elderly patients to enroll into cancer chemoprevention trials. Decisions differ based on geographic location and perceived trust in the patient-provider relationship. To achieve successful enrollment, trial investigators must continue to educate PCPs and ensure a strong PCP-patient relationship is maintained.","To explore the willingness of primary care providers (PCPs) to encourage enrollment of patients into cancer prevention trials. A self-administered survey was mailed to a random sample of PCPs in three geographic regions. Physicians were asked questions about their knowledge and attitudes towards cancer prevention trials. We presented a clinical vignette of a woman at high risk for breast cancer and asked if they would encourage her enrollment into a breast cancer chemoprevention trial (yes/no). Each survey included one of 16 possible clinical vignettes where patient characteristics (age, race socioeconomic status, physical mobility and co-morbidity) varied dichotomously. Bivariate analyses and logistic models were used to examine the independent effects of patient and physician characteristics on physician decisions. Two hundred and sixty-six surveys (50% response) were analyzed. The mean age of respondents was 48; 54% were White, 35% Asian and 5% Black. By design physicians were evenly distributed by gender, specialty and geographic location. Overall, 53% would encourage enrollment into a breast cancer chemoprevention trial. Significant predictors of a recommendation to enroll were: geographic location in California or Georgia, younger vignette patient and anticipating an increase in patient trust after recommending enrollment. PCPs are less likely to encourage elderly patients to enroll into cancer chemoprevention trials. Decisions differ based on geographic location and perceived trust in the patient-provider relationship. To achieve successful enrollment, trial investigators must continue to educate PCPs and ensure a strong PCP-patient relationship is maintained."
Hormonal approaches to breast cancer treatment and prevention: an overview.,Vogel,"Journal Article, Review",https://pubmed.ncbi.nlm.nih.gov/8824459/,Tamoxifen appears to be the therapy of choice for the initial treatment of metastatic breast cancer in both premenopausal and postmenopausal women. Some clinicians prefer oophorectomy or the use of luteinizing hormone releasing hormone analogues.,"Hormonal agents play a critical role in the palliation of advanced breast cancer, as well as adjuvant therapy to surgery and radiation in patients with primary breast cancer. Tamoxifen appears to be the therapy of choice for the initial treatment of metastatic breast cancer in both premenopausal and postmenopausal women, although some clinicians prefer oophorectomy or the use of luteinizing hormone releasing hormone analogues in premenopausal patients. Historically, second-line hormonal therapy for metastatic disease has been with a progestin; however, due to the troubling side effects of weight gain and dyspnea, progestins may soon be replaced by aromatase inhibitors. The development of new antiestrogens lacking estrogen-agonist activity for metastatic disease is in its earliest clinical developmental phases. For adjuvant therapy in postmenopausal women, there is conflicting evidence as to whether the combination of a hormonal agent (ie, tamoxifen) plus chemotherapy provides an advantage over hormonal therapy alone. In premenopausal women areas of active investigation include combination hormonal therapy (eg, tamoxifen plus luteinizing hormone releasing hormone analogues or oophorectomy) and combination chemohormonal therapy (concomitant v sequential). Tamoxifen had been associated with rare cases of thromboembolic events and secondary endometrial cancers. The etiology of these secondary cancers is unclear and controversial; however, the benefits of tamoxifen far outweigh the risks for both palliative and surgical adjuvant therapy. The success of tamoxifen in preventing cancer recurrence in the contralateral breast has led to clinical investigation of the drug for the chemoprevention of breast cancer in women at high risk for development of the disease. The role of tamoxifen for this indication remains to be determined following completion of the National Surgical Adjuvant Breast and Bowel Project trial in North America and additional trials in the United Kingdom and Italy."
Breast malignancy.,"Bender, Schnürch","Journal Article, Review",https://pubmed.ncbi.nlm.nih.gov/1878498/,Screening may reduce mortality by 30% in women aged 50 to 69. Breast-conserving lumpectomy is indicated for small tumors. A combination of hormonal and chemotherapy may be useful in some postmenopausal node-positive patients.,"Risks associated with oral contraceptive use have been shown for women who begin using them before age 25 and before their first full-term pregnancy. The effectiveness of chemoprevention is being studied. Screening may reduce mortality by 30% in women aged 50 to 69. Breast-conserving lumpectomy is indicated for small tumors. In some postmenopausal node-positive patients, a combination of hormonal and chemotherapy may be useful. In metastatic breast cancer, dose-intensification of chemotherapy has been investigated. Palliative treatment involves tamoxifen. Analysis of steroid hormone receptor status involves fine-needle aspiration, enzyme immunoassay, and a new autoradiographic procedure using radiolabeled estrogens. Prognostic factors under study include oncogene amplification, urokinase plasminogen activator level, expression of growth factors and growth factor receptors, proliferation parameters such as ploidy and S-phase fraction, mutations, and cathepsin D levels."
Prevention of breast cancer.,"Jones, Powles","Clinical Trial, Journal Article, Review",https://pubmed.ncbi.nlm.nih.gov/1843103/,"Breast cancer is the most common cancer in women in the United Kingdom. Despite advances in treatment, metastatic disease remains incurable and many women die from the disease. Evidence implicates estrogenic stimulation in the development and progression of breast cancer.","Breast cancer is the most common cancer in women in the United Kingdom and despite advances in treatment, metastatic disease remains incurable and many women die from the disease. There is extensive biologic and clinical evidence implicating estrogenic stimulation in the development and progression of breast cancer. The success of tamoxifen in adjuvant breast cancer trials in delaying the recurrence of disease and preventing second primary breast cancers and, in postmenopausal women, conferring a survival benefit, has led to increasing interest in the use of tamoxifen as a chemopreventive agent against breast cancer. It remains to be seen whether tamoxifen will act as a true preventive agent or whether it will merely delay the appearance of breast cancer, in which case the use of the drug may alter the natural history of the disease in women who have been exposed to tamoxifen. The optimal duration of drug intervention, the appropriate target population for chemoprevention, and the cost-benefit ratio of tamoxifen prevention are all issues that must be formally addressed in carefully controlled trials. Some data concerning duration and side effects are already available from epidemiologic studies and long-term clinical follow-up of patients exposed to tamoxifen."
